{
    "$schema": "https://json-schema.org/draft/2020-12/schema",
    "$id": "http://api.example.com/profile.json",
    "type": "object",
    "properties": {
        "name": {
            "type": "string",
            "minLength": 1,
            "maxLength": 64,
            "pattern": "^[a-zA-Z0-9\\-]+(\\s[a-zA-Z0-9\\-]+)*$"
        },
        "age": {
            "type": "integer",
            "minimum": 18,
            "maximum": 100
        },
        "email": {
            "type": "string",
            "maxLength": 128,
            "format": "email"
        },
        "website": {
            "type": ["string", "null"],
            "maxLength": 128,
            "format": "hostname"
        },
        "location": {
            "type": "object",
            "properties": {
                "country": {
                    "enum": ["US", "CA", "GB"]
                },
                "address": {
                    "type": "string",
                    "maxLength": 128
                }
            },
            "required": ["country", "address"],
            "additionalProperties": false
        },
        "available_for_hire": {
            "type": "boolean"
        },
        "interests": {
            "type": "array",
            "minItems": 3,
            "maxItems": 100,
            "uniqueItems": true,
            "items": {
                "type": "string",
                "maxLength": 64
            }
        },
        "skills": {
            "type": "array",
            "maxItems": 100,
            "uniqueItems": true,
            "items": {
                "type": "object",
                "properties": {
                    "name": {
                        "type": "string",
                        "minLenght": 1,
                        "maxLength": 64
                    },
                    "value": {
                        "type": "number",
                        "minimum": 0,
                        "maximum": 100,
                        "multipleOf": 0.25
                    }
                },
                "required": ["name", "value"],
                "additionalProperties": false
            }
        }
    },
    "required": ["name", "age", "email", "location",
        "available_for_hire", "interests", "skills"],
    "additionalProperties": false
}
